{
  "$schema": "https://json-schema.org/draft/2020-12/schema",
  "$id": "https://agentic-sdlc.dev/contracts/v1/domain.schema.json",
  "title": "Domain",
  "description": "Describes a bounded business domain that spans one or more repositories. Produced during onboarding through manual knowledge capture with the domain team. Stored in the state store and referenced by the orchestration engine during triage and planning.",
  "type": "object",
  "additionalProperties": false,
  "required": [
    "schema_version",
    "id",
    "name",
    "repositories",
    "ownership"
  ],
  "properties": {
    "schema_version": {
      "const": "v1"
    },
    "id": {
      "type": "string",
      "minLength": 1,
      "description": "Unique identifier for the domain (e.g., 'payments', 'identity', 'notifications')."
    },
    "name": {
      "type": "string",
      "minLength": 1,
      "description": "Human-readable domain name."
    },
    "description": {
      "type": "string",
      "description": "What this domain does, its boundaries, and what it does not own."
    },
    "repositories": {
      "type": "array",
      "minItems": 1,
      "items": {
        "$ref": "#/$defs/domain_repo"
      },
      "description": "The repositories that belong to this domain."
    },
    "ownership": {
      "type": "object",
      "additionalProperties": false,
      "required": ["team"],
      "properties": {
        "team": {
          "type": "string",
          "description": "Primary team that owns this domain (e.g., GitHub team slug or org team name)."
        },
        "escalation_contacts": {
          "type": "array",
          "items": {
            "type": "string"
          },
          "description": "People or groups to escalate to when the agent cannot proceed."
        },
        "domain_experts": {
          "type": "array",
          "items": {
            "type": "string"
          },
          "description": "People with deep tribal knowledge of this domain. Captured during onboarding."
        }
      }
    },
    "cross_repo_dependencies": {
      "type": "array",
      "items": {
        "$ref": "#/$defs/cross_repo_dep"
      },
      "description": "Explicit dependencies between repositories in this domain. Used during planning to determine step ordering for multi-repo tasks."
    },
    "tribal_knowledge": {
      "type": "array",
      "items": {
        "$ref": "#/$defs/knowledge_entry"
      },
      "description": "Captured domain knowledge that is not in documentation or code. This is the most valuable output of onboarding — conventions, gotchas, implicit rules that only the team knows."
    },
    "shared_conventions": {
      "type": "object",
      "additionalProperties": false,
      "properties": {
        "branching_strategy": {
          "type": "string",
          "description": "How the domain handles branching (e.g., 'trunk-based', 'gitflow', 'feature-branches')."
        },
        "release_process": {
          "type": "string",
          "description": "How releases happen across this domain's repos."
        },
        "testing_philosophy": {
          "type": "string",
          "description": "Domain-level testing approach (e.g., 'integration tests across services required before merge')."
        },
        "deployment_order": {
          "type": "array",
          "items": {
            "type": "string"
          },
          "description": "When deploying changes across repos, this is the safe order. References repo IDs from the repositories array."
        },
        "notes": {
          "type": "array",
          "items": {
            "type": "string"
          },
          "description": "Any other domain-wide conventions that don't fit the above fields."
        }
      }
    },
    "external_dependencies": {
      "type": "array",
      "items": {
        "type": "object",
        "additionalProperties": false,
        "required": ["name", "type"],
        "properties": {
          "name": {
            "type": "string",
            "description": "Name of the external dependency (e.g., 'Stripe API', 'Auth0', 'PostgreSQL')."
          },
          "type": {
            "type": "string",
            "enum": ["api", "database", "service", "infrastructure", "vendor"],
            "description": "Category of the external dependency."
          },
          "notes": {
            "type": "string",
            "description": "Anything the agent should know about this dependency."
          }
        }
      },
      "description": "External systems this domain depends on that are outside the org's control."
    },
    "onboarded_at": {
      "type": "string",
      "format": "date-time",
      "description": "When this domain was onboarded to the framework."
    },
    "last_reviewed_at": {
      "type": "string",
      "format": "date-time",
      "description": "When the domain contract was last reviewed by the team for accuracy."
    }
  },
  "$defs": {
    "domain_repo": {
      "type": "object",
      "additionalProperties": false,
      "required": ["id", "name"],
      "properties": {
        "id": {
          "type": "string",
          "description": "Repository identifier (e.g., 'org/payment-service')."
        },
        "name": {
          "type": "string",
          "description": "Human-readable repo name."
        },
        "role": {
          "type": "string",
          "description": "What role this repo plays in the domain (e.g., 'primary API', 'shared library', 'worker', 'frontend')."
        },
        "notes": {
          "type": "string",
          "description": "Anything specific about this repo the agent should know."
        }
      }
    },
    "cross_repo_dep": {
      "type": "object",
      "additionalProperties": false,
      "required": ["from_repo", "to_repo", "relationship"],
      "properties": {
        "from_repo": {
          "type": "string",
          "description": "The repo that depends on another."
        },
        "to_repo": {
          "type": "string",
          "description": "The repo being depended on."
        },
        "relationship": {
          "type": "string",
          "enum": ["imports", "calls_api", "shares_database", "publishes_events", "consumes_events", "deploy_before"],
          "description": "Nature of the dependency."
        },
        "notes": {
          "type": "string"
        }
      }
    },
    "knowledge_entry": {
      "type": "object",
      "additionalProperties": false,
      "required": ["topic", "content"],
      "properties": {
        "topic": {
          "type": "string",
          "description": "Short label for the knowledge area (e.g., 'payment retries', 'auth token rotation')."
        },
        "content": {
          "type": "string",
          "description": "The actual knowledge — what the team knows that isn't written down."
        },
        "source": {
          "type": "string",
          "description": "Who provided this knowledge (e.g., 'Jane Doe, staff engineer')."
        },
        "captured_at": {
          "type": "string",
          "format": "date-time"
        }
      }
    }
  }
}
